{
  "schemaVersion": 1,
  "productId": "PROD-JAPA",
  "standards": [
    {
      "id": "STD-STUDIO-OS",
      "repository": "pri8771/studio-ios",
      "version": "0.1.0",
      "commit": "f4f14939d94ef225fd7fca950f6a3b68f84c1d6c",
      "overrides": []
    },
    {
      "id": "STD-IOS-APP-FACTORY",
      "repository": "pri8771/iOS_app_factory_rules",
      "version": "0.4.0",
      "commit": "4b8b12ea87d78d392485ea8a73440a17ee50bba9",
      "overrides": []
    }
  ],
  "lastChecked": "2026-07-20"
}
